{
  "profile_name": "cdo01-sandbox",
  "system": "CDO-CHECKOUT-PAYMENT",
  "default_namespace": "tenant-checkout",
  "default_deployment_template": "deployment/{{target_service}}",
  "default_service": "checkout-api",
  "allowed_namespaces": [
    "tenant-checkout",
    "tenant-payment"
  ],
  "services": [
    "checkout-api",
    "checkout-frontend",
    "checkout-worker",
    "order-api",
    "payment-worker"
  ],
  "metric_types": [
    "cpu",
    "mem",
    "delay",
    "loss",
    "socket",
    "disk"
  ],
  "fault_runbook_mapping": {
    "cpu": "CPUSaturationRecoveryRunbook",
    "mem": "MemoryLeakRecoveryRunbook",
    "delay": "NetworkLatencyRecoveryRunbook",
    "loss": "PacketLossRecoveryRunbook",
    "disk": "DiskIORecoveryRunbook",
    "socket": "SocketExhaustionRecoveryRunbook"
  },
  "dependency_graph": {
    "checkout-frontend": ["checkout-api", "checkout-worker"],
    "checkout-api": ["checkout-worker", "order-api"],
    "payment-worker": ["order-api"]
  },
  "runbooks": {
    "CPUSaturationRecoveryRunbook": {
      "name": "CPUSaturationRecoveryRunbook",
      "description": "Handle CPU saturation by scaling replicas.",
      "pattern_type": "urgent",
      "action_plan": [
        {
          "step": 1,
          "action": "SCALE_REPLICAS",
          "target": "deployment/{{target_service}}",
          "params": {
            "namespace": "tenant-checkout",
            "replicas": 3
          }
        }
      ],
      "blast_radius_config": {
        "max_pod_impact_pct": 25,
        "circuit_breaker_error_rate": 0.2,
        "allowed_namespaces": [
          "tenant-checkout",
          "tenant-payment"
        ]
      },
      "verify_policy": {
        "window_seconds": 120,
        "success_conditions": [
          "pod_ready == true"
        ]
      }
    },
    "MemoryLeakRecoveryRunbook": {
      "name": "MemoryLeakRecoveryRunbook",
      "description": "Handle memory pressure by patching memory limits.",
      "pattern_type": "urgent",
      "action_plan": [
        {
          "step": 1,
          "action": "PATCH_MEMORY_LIMIT",
          "target": "deployment/{{target_service}}",
          "params": {
            "namespace": "tenant-checkout",
            "container": "main",
            "memory_request_mb": 512,
            "memory_limit_mb": 768
          }
        }
      ],
      "blast_radius_config": {
        "max_pod_impact_pct": 25,
        "circuit_breaker_error_rate": 0.2,
        "allowed_namespaces": [
          "tenant-checkout",
          "tenant-payment"
        ]
      },
      "verify_policy": {
        "window_seconds": 120,
        "success_conditions": [
          "pod_ready == true",
          "restart_count_no_increase == true"
        ]
      }
    },
    "NetworkLatencyRecoveryRunbook": {
      "name": "NetworkLatencyRecoveryRunbook",
      "description": "Handle network latency via rolling restart.",
      "pattern_type": "urgent",
      "action_plan": [
        {
          "step": 1,
          "action": "RESTART_DEPLOYMENT",
          "target": "deployment/{{target_service}}",
          "params": {
            "namespace": "tenant-checkout",
            "grace_period_seconds": 30
          }
        }
      ],
      "blast_radius_config": {
        "max_pod_impact_pct": 25,
        "circuit_breaker_error_rate": 0.2,
        "allowed_namespaces": [
          "tenant-checkout",
          "tenant-payment"
        ]
      },
      "verify_policy": {
        "window_seconds": 120,
        "success_conditions": [
          "pod_ready == true",
          "service_latency_p95 < 200.0"
        ]
      }
    },
    "PacketLossRecoveryRunbook": {
      "name": "PacketLossRecoveryRunbook",
      "description": "Handle packet loss via rolling restart.",
      "pattern_type": "urgent",
      "action_plan": [
        {
          "step": 1,
          "action": "RESTART_DEPLOYMENT",
          "target": "deployment/{{target_service}}",
          "params": {
            "namespace": "tenant-checkout",
            "grace_period_seconds": 30
          }
        }
      ],
      "blast_radius_config": {
        "max_pod_impact_pct": 25,
        "circuit_breaker_error_rate": 0.2,
        "allowed_namespaces": [
          "tenant-checkout",
          "tenant-payment"
        ]
      },
      "verify_policy": {
        "window_seconds": 120,
        "success_conditions": [
          "pod_ready == true",
          "service_error_rate < 0.01"
        ]
      }
    },
    "DiskIORecoveryRunbook": {
      "name": "DiskIORecoveryRunbook",
      "description": "Handle disk I/O bottlenecks via rolling restart.",
      "pattern_type": "urgent",
      "action_plan": [
        {
          "step": 1,
          "action": "RESTART_DEPLOYMENT",
          "target": "deployment/{{target_service}}",
          "params": {
            "namespace": "tenant-checkout",
            "grace_period_seconds": 30
          }
        }
      ],
      "blast_radius_config": {
        "max_pod_impact_pct": 25,
        "circuit_breaker_error_rate": 0.2,
        "allowed_namespaces": [
          "tenant-checkout",
          "tenant-payment"
        ]
      },
      "verify_policy": {
        "window_seconds": 120,
        "success_conditions": [
          "pod_ready == true"
        ]
      }
    },
    "SocketExhaustionRecoveryRunbook": {
      "name": "SocketExhaustionRecoveryRunbook",
      "description": "Handle socket exhaustion by scaling replicas.",
      "pattern_type": "urgent",
      "action_plan": [
        {
          "step": 1,
          "action": "SCALE_REPLICAS",
          "target": "deployment/{{target_service}}",
          "params": {
            "namespace": "tenant-checkout",
            "replicas": 3
          }
        }
      ],
      "blast_radius_config": {
        "max_pod_impact_pct": 25,
        "circuit_breaker_error_rate": 0.2,
        "allowed_namespaces": [
          "tenant-checkout",
          "tenant-payment"
        ]
      },
      "verify_policy": {
        "window_seconds": 120,
        "success_conditions": [
          "pod_ready == true"
        ]
      }
    },
    "DefaultRecoveryRunbook": {
      "name": "DefaultRecoveryRunbook",
      "description": "Fallback restart for unknown fault types.",
      "pattern_type": "urgent",
      "action_plan": [
        {
          "step": 1,
          "action": "RESTART_DEPLOYMENT",
          "target": "deployment/{{target_service}}",
          "params": {
            "namespace": "tenant-checkout",
            "grace_period_seconds": 30
          }
        }
      ],
      "blast_radius_config": {
        "max_pod_impact_pct": 25,
        "circuit_breaker_error_rate": 0.2,
        "allowed_namespaces": [
          "tenant-checkout",
          "tenant-payment"
        ]
      },
      "verify_policy": {
        "window_seconds": 120,
        "success_conditions": [
          "pod_ready == true"
        ]
      }
    }
  }
}
